{
  "name": "deep-research",
  "version": "1.0.0",
  "domain": "Multi-source research with cross-validation",
  "createdAt": "2026-06-09",
  "executionMode": "team",
  "pattern": "fan-out-fan-in",
  "orchestrator": ".claude/skills/research-orchestrator/SKILL.md",
  "agents": [
    { "name": "web-scout", "type": "general-purpose", "model": "sonnet", "file": ".claude/agents/web-scout.md", "skills": ["web-search"], "role": "Gather web/news sources" },
    { "name": "academic-scout", "type": "general-purpose", "model": "opus", "file": ".claude/agents/academic-scout.md", "skills": ["paper-search"], "role": "Gather peer-reviewed sources" },
    { "name": "synthesizer", "type": "custom", "model": "opus", "file": ".claude/agents/synthesizer.md", "skills": ["cross-validate", "report-write"], "role": "Cross-validate findings and write the report" }
  ],
  "skills": [
    { "name": "web-search", "file": ".claude/skills/web-search/SKILL.md", "usedBy": ["web-scout"] },
    { "name": "paper-search", "file": ".claude/skills/paper-search/SKILL.md", "usedBy": ["academic-scout"] },
    { "name": "cross-validate", "file": ".claude/skills/cross-validate/SKILL.md", "usedBy": ["synthesizer"] },
    { "name": "report-write", "file": ".claude/skills/report-write/SKILL.md", "usedBy": ["synthesizer"] }
  ],
  "changelog": [
    { "date": "2026-06-09", "change": "initial build", "target": "all", "reason": "-" }
  ]
}
